"No.","Time","Source","Destination","Protocol","Length","Info"
"1","0.000000","127.0.0.1","127.0.0.1","TCP","45","49734  >  49735 [PSH, ACK] Seq=1 Ack=1 Win=255 Len=1"
"2","0.000086","127.0.0.1","127.0.0.1","TCP","44","49735  >  49734 [ACK] Seq=1 Ack=2 Win=909 Len=0"
"3","0.000393","127.0.0.1","127.0.0.1","TCP","45","49739  >  49738 [PSH, ACK] Seq=1 Ack=1 Win=255 Len=1"
"4","0.000449","127.0.0.1","127.0.0.1","TCP","44","49738  >  49739 [ACK] Seq=1 Ack=2 Win=911 Len=0"
"5","0.004466","127.0.0.1","127.0.0.1","TCP","45","49734  >  49735 [PSH, ACK] Seq=2 Ack=1 Win=255 Len=1"
"6","0.004537","127.0.0.1","127.0.0.1","TCP","44","49735  >  49734 [ACK] Seq=1 Ack=3 Win=909 Len=0"
"7","0.004931","127.0.0.1","127.0.0.1","TCP","45","49739  >  49738 [PSH, ACK] Seq=2 Ack=1 Win=255 Len=1"
"8","0.005009","127.0.0.1","127.0.0.1","TCP","44","49738  >  49739 [ACK] Seq=1 Ack=3 Win=911 Len=0"
"9","0.005189","127.0.0.1","127.0.0.1","TCP","45","49734  >  49735 [PSH, ACK] Seq=3 Ack=1 Win=255 Len=1"
"10","0.005229","127.0.0.1","127.0.0.1","TCP","44","49735  >  49734 [ACK] Seq=1 Ack=4 Win=909 Len=0"
"11","0.005757","127.0.0.1","127.0.0.1","TCP","45","49739  >  49738 [PSH, ACK] Seq=3 Ack=1 Win=255 Len=1"
"12","0.005861","127.0.0.1","127.0.0.1","TCP","44","49738  >  49739 [ACK] Seq=1 Ack=4 Win=911 Len=0"
"13","0.006069","127.0.0.1","127.0.0.1","TCP","45","49734  >  49735 [PSH, ACK] Seq=4 Ack=1 Win=255 Len=1"
"14","0.006109","127.0.0.1","127.0.0.1","TCP","44","49735  >  49734 [ACK] Seq=1 Ack=5 Win=909 Len=0"
"15","0.006611","127.0.0.1","127.0.0.1","TCP","45","49739  >  49738 [PSH, ACK] Seq=4 Ack=1 Win=255 Len=1"
"16","0.006740","127.0.0.1","127.0.0.1","TCP","44","49738  >  49739 [ACK] Seq=1 Ack=5 Win=911 Len=0"
"17","0.007131","127.0.0.1","127.0.0.1","TCP","45","49734  >  49735 [PSH, ACK] Seq=5 Ack=1 Win=255 Len=1"
"18","0.007165","127.0.0.1","127.0.0.1","TCP","44","49735  >  49734 [ACK] Seq=1 Ack=6 Win=909 Len=0"
"19","0.007406","127.0.0.1","127.0.0.1","TCP","45","49739  >  49738 [PSH, ACK] Seq=5 Ack=1 Win=255 Len=1"
"20","0.007460","127.0.0.1","127.0.0.1","TCP","44","49738  >  49739 [ACK] Seq=1 Ack=6 Win=911 Len=0"
"21","0.007890","127.0.0.1","127.0.0.1","TCP","45","49734  >  49735 [PSH, ACK] Seq=6 Ack=1 Win=255 Len=1"
"22","0.007933","127.0.0.1","127.0.0.1","TCP","44","49735  >  49734 [ACK] Seq=1 Ack=7 Win=909 Len=0"
"23","0.008221","127.0.0.1","127.0.0.1","TCP","45","49739  >  49738 [PSH, ACK] Seq=6 Ack=1 Win=255 Len=1"
"24","0.008276","127.0.0.1","127.0.0.1","TCP","44","49738  >  49739 [ACK] Seq=1 Ack=7 Win=911 Len=0"
"25","0.008502","127.0.0.1","127.0.0.1","TCP","45","49734  >  49735 [PSH, ACK] Seq=7 Ack=1 Win=255 Len=1"
"26","0.008548","127.0.0.1","127.0.0.1","TCP","44","49735  >  49734 [ACK] Seq=1 Ack=8 Win=909 Len=0"
"27","0.008825","127.0.0.1","127.0.0.1","TCP","45","49739  >  49738 [PSH, ACK] Seq=7 Ack=1 Win=255 Len=1"
"28","0.008877","127.0.0.1","127.0.0.1","TCP","44","49738  >  49739 [ACK] Seq=1 Ack=8 Win=911 Len=0"
"29","0.009124","127.0.0.1","127.0.0.1","TCP","45","49734  >  49735 [PSH, ACK] Seq=8 Ack=1 Win=255 Len=1"
"30","0.009164","127.0.0.1","127.0.0.1","TCP","44","49735  >  49734 [ACK] Seq=1 Ack=9 Win=909 Len=0"
"31","0.009438","127.0.0.1","127.0.0.1","TCP","45","49739  >  49738 [PSH, ACK] Seq=8 Ack=1 Win=255 Len=1"
"32","0.009492","127.0.0.1","127.0.0.1","TCP","44","49738  >  49739 [ACK] Seq=1 Ack=9 Win=911 Len=0"
"33","0.009781","127.0.0.1","127.0.0.1","TCP","45","49734  >  49735 [PSH, ACK] Seq=9 Ack=1 Win=255 Len=1"
"34","0.009824","127.0.0.1","127.0.0.1","TCP","44","49735  >  49734 [ACK] Seq=1 Ack=10 Win=909 Len=0"
"35","0.010151","127.0.0.1","127.0.0.1","TCP","45","49739  >  49738 [PSH, ACK] Seq=9 Ack=1 Win=255 Len=1"
"36","0.010204","127.0.0.1","127.0.0.1","TCP","44","49738  >  49739 [ACK] Seq=1 Ack=10 Win=911 Len=0"
"37","0.010347","127.0.0.1","127.0.0.1","TCP","45","49734  >  49735 [PSH, ACK] Seq=10 Ack=1 Win=255 Len=1"
"38","0.010388","127.0.0.1","127.0.0.1","TCP","44","49735  >  49734 [ACK] Seq=1 Ack=11 Win=909 Len=0"
"39","0.010685","127.0.0.1","127.0.0.1","TCP","45","49739  >  49738 [PSH, ACK] Seq=10 Ack=1 Win=255 Len=1"
"40","0.010736","127.0.0.1","127.0.0.1","TCP","44","49738  >  49739 [ACK] Seq=1 Ack=11 Win=911 Len=0"
"41","0.010905","127.0.0.1","127.0.0.1","TCP","45","49734  >  49735 [PSH, ACK] Seq=11 Ack=1 Win=255 Len=1"
"42","0.010951","127.0.0.1","127.0.0.1","TCP","44","49735  >  49734 [ACK] Seq=1 Ack=12 Win=909 Len=0"
"43","0.011172","127.0.0.1","127.0.0.1","TCP","45","49739  >  49738 [PSH, ACK] Seq=11 Ack=1 Win=255 Len=1"
"44","0.011256","127.0.0.1","127.0.0.1","TCP","44","49738  >  49739 [ACK] Seq=1 Ack=12 Win=911 Len=0"
"45","0.011398","127.0.0.1","127.0.0.1","TCP","45","49734  >  49735 [PSH, ACK] Seq=12 Ack=1 Win=255 Len=1"
"46","0.011436","127.0.0.1","127.0.0.1","TCP","44","49735  >  49734 [ACK] Seq=1 Ack=13 Win=909 Len=0"
"47","0.011645","127.0.0.1","127.0.0.1","TCP","45","49739  >  49738 [PSH, ACK] Seq=12 Ack=1 Win=255 Len=1"
"48","0.011686","127.0.0.1","127.0.0.1","TCP","44","49738  >  49739 [ACK] Seq=1 Ack=13 Win=911 Len=0"
"49","0.011875","127.0.0.1","127.0.0.1","TCP","45","49734  >  49735 [PSH, ACK] Seq=13 Ack=1 Win=255 Len=1"
"50","0.011911","127.0.0.1","127.0.0.1","TCP","44","49735  >  49734 [ACK] Seq=1 Ack=14 Win=909 Len=0"
"51","0.012139","127.0.0.1","127.0.0.1","TCP","45","49739  >  49738 [PSH, ACK] Seq=13 Ack=1 Win=255 Len=1"
"52","0.012183","127.0.0.1","127.0.0.1","TCP","44","49738  >  49739 [ACK] Seq=1 Ack=14 Win=911 Len=0"
"53","0.012318","127.0.0.1","127.0.0.1","TCP","45","49734  >  49735 [PSH, ACK] Seq=14 Ack=1 Win=255 Len=1"
"54","0.012354","127.0.0.1","127.0.0.1","TCP","44","49735  >  49734 [ACK] Seq=1 Ack=15 Win=909 Len=0"
"55","0.012601","127.0.0.1","127.0.0.1","TCP","45","49739  >  49738 [PSH, ACK] Seq=14 Ack=1 Win=255 Len=1"
"56","0.012669","127.0.0.1","127.0.0.1","TCP","44","49738  >  49739 [ACK] Seq=1 Ack=15 Win=911 Len=0"
"57","0.012809","127.0.0.1","127.0.0.1","TCP","45","49734  >  49735 [PSH, ACK] Seq=15 Ack=1 Win=255 Len=1"
"58","0.012845","127.0.0.1","127.0.0.1","TCP","44","49735  >  49734 [ACK] Seq=1 Ack=16 Win=909 Len=0"
"59","0.013093","127.0.0.1","127.0.0.1","TCP","45","49739  >  49738 [PSH, ACK] Seq=15 Ack=1 Win=255 Len=1"
"60","0.013147","127.0.0.1","127.0.0.1","TCP","44","49738  >  49739 [ACK] Seq=1 Ack=16 Win=911 Len=0"
"61","0.013312","127.0.0.1","127.0.0.1","TCP","45","49734  >  49735 [PSH, ACK] Seq=16 Ack=1 Win=255 Len=1"
"62","0.013350","127.0.0.1","127.0.0.1","TCP","44","49735  >  49734 [ACK] Seq=1 Ack=17 Win=909 Len=0"
"63","0.013638","127.0.0.1","127.0.0.1","TCP","45","49739  >  49738 [PSH, ACK] Seq=16 Ack=1 Win=255 Len=1"
"64","0.013711","127.0.0.1","127.0.0.1","TCP","44","49738  >  49739 [ACK] Seq=1 Ack=17 Win=911 Len=0"
"65","0.013827","127.0.0.1","127.0.0.1","TCP","45","49734  >  49735 [PSH, ACK] Seq=17 Ack=1 Win=255 Len=1"
"66","0.013852","127.0.0.1","127.0.0.1","TCP","44","49735  >  49734 [ACK] Seq=1 Ack=18 Win=909 Len=0"
"67","0.014294","127.0.0.1","127.0.0.1","TCP","45","49739  >  49738 [PSH, ACK] Seq=17 Ack=1 Win=255 Len=1"
"68","0.014355","127.0.0.1","127.0.0.1","TCP","44","49738  >  49739 [ACK] Seq=1 Ack=18 Win=911 Len=0"
"69","0.014542","127.0.0.1","127.0.0.1","TCP","45","49734  >  49735 [PSH, ACK] Seq=18 Ack=1 Win=255 Len=1"
"70","0.014559","127.0.0.1","127.0.0.1","TCP","44","49735  >  49734 [ACK] Seq=1 Ack=19 Win=909 Len=0"
"71","0.014910","127.0.0.1","127.0.0.1","TCP","45","49739  >  49738 [PSH, ACK] Seq=18 Ack=1 Win=255 Len=1"
"72","0.014990","127.0.0.1","127.0.0.1","TCP","44","49738  >  49739 [ACK] Seq=1 Ack=19 Win=911 Len=0"
"73","0.015091","127.0.0.1","127.0.0.1","TCP","45","49734  >  49735 [PSH, ACK] Seq=19 Ack=1 Win=255 Len=1"
"74","0.015131","127.0.0.1","127.0.0.1","TCP","44","49735  >  49734 [ACK] Seq=1 Ack=20 Win=909 Len=0"
"75","0.015334","127.0.0.1","127.0.0.1","TCP","45","49739  >  49738 [PSH, ACK] Seq=19 Ack=1 Win=255 Len=1"
"76","0.015408","127.0.0.1","127.0.0.1","TCP","44","49738  >  49739 [ACK] Seq=1 Ack=20 Win=911 Len=0"
"77","0.015528","127.0.0.1","127.0.0.1","TCP","45","49734  >  49735 [PSH, ACK] Seq=20 Ack=1 Win=255 Len=1"
"78","0.015565","127.0.0.1","127.0.0.1","TCP","44","49735  >  49734 [ACK] Seq=1 Ack=21 Win=909 Len=0"
"79","0.015802","127.0.0.1","127.0.0.1","TCP","45","49739  >  49738 [PSH, ACK] Seq=20 Ack=1 Win=255 Len=1"
"80","0.015876","127.0.0.1","127.0.0.1","TCP","44","49738  >  49739 [ACK] Seq=1 Ack=21 Win=911 Len=0"
"81","0.019692","127.0.0.1","127.0.0.1","TCP","45","49734  >  49735 [PSH, ACK] Seq=21 Ack=1 Win=255 Len=1"
"82","0.019740","127.0.0.1","127.0.0.1","TCP","44","49735  >  49734 [ACK] Seq=1 Ack=22 Win=909 Len=0"
"83","0.019888","127.0.0.1","127.0.0.1","TCP","45","49739  >  49738 [PSH, ACK] Seq=21 Ack=1 Win=255 Len=1"
"84","0.019939","127.0.0.1","127.0.0.1","TCP","44","49738  >  49739 [ACK] Seq=1 Ack=22 Win=911 Len=0"
"85","0.129257","127.0.0.1","127.0.0.1","TCP","45","49734  >  49735 [PSH, ACK] Seq=22 Ack=1 Win=255 Len=1"
"86","0.129302","127.0.0.1","127.0.0.1","TCP","44","49735  >  49734 [ACK] Seq=1 Ack=23 Win=909 Len=0"
"87","0.452012","127.0.0.1","127.0.0.1","TCP","45","49734  >  49735 [PSH, ACK] Seq=23 Ack=1 Win=255 Len=1"
"88","0.452082","127.0.0.1","127.0.0.1","TCP","44","49735  >  49734 [ACK] Seq=1 Ack=24 Win=909 Len=0"
"89","0.452395","127.0.0.1","127.0.0.1","TCP","45","49739  >  49738 [PSH, ACK] Seq=22 Ack=1 Win=255 Len=1"
"90","0.452462","127.0.0.1","127.0.0.1","TCP","44","49738  >  49739 [ACK] Seq=1 Ack=23 Win=911 Len=0"
"91","0.452514","127.0.0.1","127.0.0.1","TCP","45","49739  >  49738 [PSH, ACK] Seq=23 Ack=1 Win=255 Len=1"
"92","0.452559","127.0.0.1","127.0.0.1","TCP","44","49738  >  49739 [ACK] Seq=1 Ack=24 Win=911 Len=0"
"93","0.452987","127.0.0.1","127.0.0.1","TCP","45","49734  >  49735 [PSH, ACK] Seq=24 Ack=1 Win=255 Len=1"
"94","0.453042","127.0.0.1","127.0.0.1","TCP","44","49735  >  49734 [ACK] Seq=1 Ack=25 Win=909 Len=0"
"95","0.453426","127.0.0.1","127.0.0.1","TCP","45","49739  >  49738 [PSH, ACK] Seq=24 Ack=1 Win=255 Len=1"
"96","0.453483","127.0.0.1","127.0.0.1","TCP","44","49738  >  49739 [ACK] Seq=1 Ack=25 Win=911 Len=0"
"97","0.453707","127.0.0.1","127.0.0.1","TCP","45","49734  >  49735 [PSH, ACK] Seq=25 Ack=1 Win=255 Len=1"
"98","0.453752","127.0.0.1","127.0.0.1","TCP","44","49735  >  49734 [ACK] Seq=1 Ack=26 Win=909 Len=0"
"99","0.454019","127.0.0.1","127.0.0.1","TCP","45","49739  >  49738 [PSH, ACK] Seq=25 Ack=1 Win=255 Len=1"
"100","0.454089","127.0.0.1","127.0.0.1","TCP","44","49738  >  49739 [ACK] Seq=1 Ack=26 Win=911 Len=0"
"101","0.454521","127.0.0.1","127.0.0.1","TCP","45","49734  >  49735 [PSH, ACK] Seq=26 Ack=1 Win=255 Len=1"
"102","0.454570","127.0.0.1","127.0.0.1","TCP","44","49735  >  49734 [ACK] Seq=1 Ack=27 Win=909 Len=0"
"103","0.454684","127.0.0.1","127.0.0.1","TCP","45","49739  >  49738 [PSH, ACK] Seq=26 Ack=1 Win=255 Len=1"
"104","0.454742","127.0.0.1","127.0.0.1","TCP","44","49738  >  49739 [ACK] Seq=1 Ack=27 Win=911 Len=0"
"105","0.454960","127.0.0.1","127.0.0.1","TCP","45","49734  >  49735 [PSH, ACK] Seq=27 Ack=1 Win=255 Len=1"
"106","0.454985","127.0.0.1","127.0.0.1","TCP","44","49735  >  49734 [ACK] Seq=1 Ack=28 Win=909 Len=0"
"107","0.455269","127.0.0.1","127.0.0.1","TCP","45","49739  >  49738 [PSH, ACK] Seq=27 Ack=1 Win=255 Len=1"
"108","0.455353","127.0.0.1","127.0.0.1","TCP","44","49738  >  49739 [ACK] Seq=1 Ack=28 Win=911 Len=0"
"109","0.455491","127.0.0.1","127.0.0.1","TCP","45","49734  >  49735 [PSH, ACK] Seq=28 Ack=1 Win=255 Len=1"
"110","0.455511","127.0.0.1","127.0.0.1","TCP","44","49735  >  49734 [ACK] Seq=1 Ack=29 Win=909 Len=0"
"111","0.455834","127.0.0.1","127.0.0.1","TCP","45","49739  >  49738 [PSH, ACK] Seq=28 Ack=1 Win=255 Len=1"
"112","0.455903","127.0.0.1","127.0.0.1","TCP","44","49738  >  49739 [ACK] Seq=1 Ack=29 Win=911 Len=0"
"113","0.456155","127.0.0.1","127.0.0.1","TCP","45","49734  >  49735 [PSH, ACK] Seq=29 Ack=1 Win=255 Len=1"
"114","0.456199","127.0.0.1","127.0.0.1","TCP","44","49735  >  49734 [ACK] Seq=1 Ack=30 Win=909 Len=0"
"115","0.456486","127.0.0.1","127.0.0.1","TCP","45","49739  >  49738 [PSH, ACK] Seq=29 Ack=1 Win=255 Len=1"
"116","0.456589","127.0.0.1","127.0.0.1","TCP","44","49738  >  49739 [ACK] Seq=1 Ack=30 Win=911 Len=0"
"117","0.456837","127.0.0.1","127.0.0.1","TCP","45","49734  >  49735 [PSH, ACK] Seq=30 Ack=1 Win=255 Len=1"
"118","0.456881","127.0.0.1","127.0.0.1","TCP","44","49735  >  49734 [ACK] Seq=1 Ack=31 Win=909 Len=0"
"119","0.457207","127.0.0.1","127.0.0.1","TCP","45","49739  >  49738 [PSH, ACK] Seq=30 Ack=1 Win=255 Len=1"
"120","0.457259","127.0.0.1","127.0.0.1","TCP","44","49738  >  49739 [ACK] Seq=1 Ack=31 Win=911 Len=0"
"121","0.457438","127.0.0.1","127.0.0.1","TCP","45","49734  >  49735 [PSH, ACK] Seq=31 Ack=1 Win=255 Len=1"
"122","0.457481","127.0.0.1","127.0.0.1","TCP","44","49735  >  49734 [ACK] Seq=1 Ack=32 Win=909 Len=0"
"123","0.457860","127.0.0.1","127.0.0.1","TCP","45","49739  >  49738 [PSH, ACK] Seq=31 Ack=1 Win=255 Len=1"
"124","0.457964","127.0.0.1","127.0.0.1","TCP","44","49738  >  49739 [ACK] Seq=1 Ack=32 Win=911 Len=0"
"125","0.458210","127.0.0.1","127.0.0.1","TCP","45","49734  >  49735 [PSH, ACK] Seq=32 Ack=1 Win=255 Len=1"
"126","0.458255","127.0.0.1","127.0.0.1","TCP","44","49735  >  49734 [ACK] Seq=1 Ack=33 Win=909 Len=0"
"127","0.458795","127.0.0.1","127.0.0.1","TCP","45","49739  >  49738 [PSH, ACK] Seq=32 Ack=1 Win=255 Len=1"
"128","0.458896","127.0.0.1","127.0.0.1","TCP","44","49738  >  49739 [ACK] Seq=1 Ack=33 Win=911 Len=0"
"129","0.459075","127.0.0.1","127.0.0.1","TCP","45","49734  >  49735 [PSH, ACK] Seq=33 Ack=1 Win=255 Len=1"
"130","0.459100","127.0.0.1","127.0.0.1","TCP","44","49735  >  49734 [ACK] Seq=1 Ack=34 Win=909 Len=0"
"131","0.459352","127.0.0.1","127.0.0.1","TCP","45","49739  >  49738 [PSH, ACK] Seq=33 Ack=1 Win=255 Len=1"
"132","0.459405","127.0.0.1","127.0.0.1","TCP","44","49738  >  49739 [ACK] Seq=1 Ack=34 Win=911 Len=0"
"133","0.459561","127.0.0.1","127.0.0.1","TCP","45","49734  >  49735 [PSH, ACK] Seq=34 Ack=1 Win=255 Len=1"
"134","0.459602","127.0.0.1","127.0.0.1","TCP","44","49735  >  49734 [ACK] Seq=1 Ack=35 Win=909 Len=0"
"135","0.460004","127.0.0.1","127.0.0.1","TCP","45","49739  >  49738 [PSH, ACK] Seq=34 Ack=1 Win=255 Len=1"
"136","0.460084","127.0.0.1","127.0.0.1","TCP","44","49738  >  49739 [ACK] Seq=1 Ack=35 Win=911 Len=0"
"137","0.460262","127.0.0.1","127.0.0.1","TCP","45","49734  >  49735 [PSH, ACK] Seq=35 Ack=1 Win=255 Len=1"
"138","0.460286","127.0.0.1","127.0.0.1","TCP","44","49735  >  49734 [ACK] Seq=1 Ack=36 Win=909 Len=0"
"139","0.460829","127.0.0.1","127.0.0.1","TCP","45","49739  >  49738 [PSH, ACK] Seq=35 Ack=1 Win=255 Len=1"
"140","0.460936","127.0.0.1","127.0.0.1","TCP","44","49738  >  49739 [ACK] Seq=1 Ack=36 Win=911 Len=0"
"141","0.461178","127.0.0.1","127.0.0.1","TCP","45","49734  >  49735 [PSH, ACK] Seq=36 Ack=1 Win=255 Len=1"
"142","0.461225","127.0.0.1","127.0.0.1","TCP","44","49735  >  49734 [ACK] Seq=1 Ack=37 Win=909 Len=0"
"143","0.461575","127.0.0.1","127.0.0.1","TCP","45","49739  >  49738 [PSH, ACK] Seq=36 Ack=1 Win=255 Len=1"
"144","0.461653","127.0.0.1","127.0.0.1","TCP","44","49738  >  49739 [ACK] Seq=1 Ack=37 Win=911 Len=0"
"145","0.461878","127.0.0.1","127.0.0.1","TCP","45","49734  >  49735 [PSH, ACK] Seq=37 Ack=1 Win=255 Len=1"
"146","0.461904","127.0.0.1","127.0.0.1","TCP","44","49735  >  49734 [ACK] Seq=1 Ack=38 Win=909 Len=0"
"147","0.462227","127.0.0.1","127.0.0.1","TCP","45","49739  >  49738 [PSH, ACK] Seq=37 Ack=1 Win=255 Len=1"
"148","0.462321","127.0.0.1","127.0.0.1","TCP","44","49738  >  49739 [ACK] Seq=1 Ack=38 Win=911 Len=0"
"149","0.462501","127.0.0.1","127.0.0.1","TCP","45","49734  >  49735 [PSH, ACK] Seq=38 Ack=1 Win=255 Len=1"
"150","0.462544","127.0.0.1","127.0.0.1","TCP","44","49735  >  49734 [ACK] Seq=1 Ack=39 Win=909 Len=0"
"151","0.462852","127.0.0.1","127.0.0.1","TCP","45","49739  >  49738 [PSH, ACK] Seq=38 Ack=1 Win=255 Len=1"
"152","0.462949","127.0.0.1","127.0.0.1","TCP","44","49738  >  49739 [ACK] Seq=1 Ack=39 Win=911 Len=0"
"153","0.463277","127.0.0.1","127.0.0.1","TCP","45","49734  >  49735 [PSH, ACK] Seq=39 Ack=1 Win=255 Len=1"
"154","0.463323","127.0.0.1","127.0.0.1","TCP","44","49735  >  49734 [ACK] Seq=1 Ack=40 Win=909 Len=0"
"155","0.463673","127.0.0.1","127.0.0.1","TCP","45","49739  >  49738 [PSH, ACK] Seq=39 Ack=1 Win=255 Len=1"
"156","0.463757","127.0.0.1","127.0.0.1","TCP","44","49738  >  49739 [ACK] Seq=1 Ack=40 Win=911 Len=0"
"157","0.463884","127.0.0.1","127.0.0.1","TCP","45","49734  >  49735 [PSH, ACK] Seq=40 Ack=1 Win=255 Len=1"
"158","0.463907","127.0.0.1","127.0.0.1","TCP","44","49735  >  49734 [ACK] Seq=1 Ack=41 Win=909 Len=0"
"159","0.464183","127.0.0.1","127.0.0.1","TCP","45","49739  >  49738 [PSH, ACK] Seq=40 Ack=1 Win=255 Len=1"
"160","0.464236","127.0.0.1","127.0.0.1","TCP","44","49738  >  49739 [ACK] Seq=1 Ack=41 Win=911 Len=0"
"161","0.464410","127.0.0.1","127.0.0.1","TCP","45","49734  >  49735 [PSH, ACK] Seq=41 Ack=1 Win=255 Len=1"
"162","0.464441","127.0.0.1","127.0.0.1","TCP","44","49735  >  49734 [ACK] Seq=1 Ack=42 Win=909 Len=0"
"163","0.464757","127.0.0.1","127.0.0.1","TCP","45","49739  >  49738 [PSH, ACK] Seq=41 Ack=1 Win=255 Len=1"
"164","0.464922","127.0.0.1","127.0.0.1","TCP","44","49738  >  49739 [ACK] Seq=1 Ack=42 Win=911 Len=0"
"165","0.468711","127.0.0.1","127.0.0.1","TCP","45","49734  >  49735 [PSH, ACK] Seq=42 Ack=1 Win=255 Len=1"
"166","0.468785","127.0.0.1","127.0.0.1","TCP","44","49735  >  49734 [ACK] Seq=1 Ack=43 Win=909 Len=0"
"167","0.468970","127.0.0.1","127.0.0.1","TCP","45","49739  >  49738 [PSH, ACK] Seq=42 Ack=1 Win=255 Len=1"
"168","0.469070","127.0.0.1","127.0.0.1","TCP","44","49738  >  49739 [ACK] Seq=1 Ack=43 Win=911 Len=0"
"169","0.601602","127.0.0.1","127.0.0.1","TCP","45","49734  >  49735 [PSH, ACK] Seq=43 Ack=1 Win=255 Len=1"
"170","0.601636","127.0.0.1","127.0.0.1","TCP","44","49735  >  49734 [ACK] Seq=1 Ack=44 Win=909 Len=0"
"171","0.627800","127.0.0.1","127.0.0.1","TCP","45","49734  >  49735 [PSH, ACK] Seq=44 Ack=1 Win=255 Len=1"
"172","0.627841","127.0.0.1","127.0.0.1","TCP","44","49735  >  49734 [ACK] Seq=1 Ack=45 Win=909 Len=0"
"173","0.628072","127.0.0.1","127.0.0.1","TCP","45","49739  >  49738 [PSH, ACK] Seq=43 Ack=1 Win=255 Len=1"
"174","0.628130","127.0.0.1","127.0.0.1","TCP","44","49738  >  49739 [ACK] Seq=1 Ack=44 Win=911 Len=0"
"175","0.628803","127.0.0.1","127.0.0.1","TCP","45","49734  >  49735 [PSH, ACK] Seq=45 Ack=1 Win=255 Len=1"
"176","0.628861","127.0.0.1","127.0.0.1","TCP","44","49735  >  49734 [ACK] Seq=1 Ack=46 Win=909 Len=0"
"177","0.652862","127.0.0.1","127.0.0.1","TCP","46","49739  >  49738 [PSH, ACK] Seq=44 Ack=1 Win=255 Len=2"
"178","0.652951","127.0.0.1","127.0.0.1","TCP","44","49738  >  49739 [ACK] Seq=1 Ack=46 Win=911 Len=0"
"179","0.653321","127.0.0.1","127.0.0.1","TCP","45","49734  >  49735 [PSH, ACK] Seq=46 Ack=1 Win=255 Len=1"
"180","0.653389","127.0.0.1","127.0.0.1","TCP","44","49735  >  49734 [ACK] Seq=1 Ack=47 Win=909 Len=0"
"181","0.654402","127.0.0.1","127.0.0.1","TCP","45","49739  >  49738 [PSH, ACK] Seq=46 Ack=1 Win=255 Len=1"
"182","0.654539","127.0.0.1","127.0.0.1","TCP","44","49738  >  49739 [ACK] Seq=1 Ack=47 Win=911 Len=0"
"183","0.655222","127.0.0.1","127.0.0.1","TCP","45","49734  >  49735 [PSH, ACK] Seq=47 Ack=1 Win=255 Len=1"
"184","0.655309","127.0.0.1","127.0.0.1","TCP","44","49735  >  49734 [ACK] Seq=1 Ack=48 Win=909 Len=0"
"185","0.655821","127.0.0.1","127.0.0.1","TCP","45","49739  >  49738 [PSH, ACK] Seq=47 Ack=1 Win=255 Len=1"
"186","0.655891","127.0.0.1","127.0.0.1","TCP","44","49738  >  49739 [ACK] Seq=1 Ack=48 Win=911 Len=0"
"187","0.656290","127.0.0.1","127.0.0.1","TCP","45","49734  >  49735 [PSH, ACK] Seq=48 Ack=1 Win=255 Len=1"
"188","0.656364","127.0.0.1","127.0.0.1","TCP","44","49735  >  49734 [ACK] Seq=1 Ack=49 Win=909 Len=0"
"189","0.657155","127.0.0.1","127.0.0.1","TCP","45","49739  >  49738 [PSH, ACK] Seq=48 Ack=1 Win=255 Len=1"
"190","0.657230","127.0.0.1","127.0.0.1","TCP","44","49738  >  49739 [ACK] Seq=1 Ack=49 Win=911 Len=0"
"191","0.657431","127.0.0.1","127.0.0.1","TCP","45","49734  >  49735 [PSH, ACK] Seq=49 Ack=1 Win=255 Len=1"
"192","0.657470","127.0.0.1","127.0.0.1","TCP","44","49735  >  49734 [ACK] Seq=1 Ack=50 Win=909 Len=0"
"193","0.657850","127.0.0.1","127.0.0.1","TCP","45","49739  >  49738 [PSH, ACK] Seq=49 Ack=1 Win=255 Len=1"
"194","0.657912","127.0.0.1","127.0.0.1","TCP","44","49738  >  49739 [ACK] Seq=1 Ack=50 Win=911 Len=0"
"195","0.658630","127.0.0.1","127.0.0.1","TCP","45","49734  >  49735 [PSH, ACK] Seq=50 Ack=1 Win=255 Len=1"
"196","0.658682","127.0.0.1","127.0.0.1","TCP","44","49735  >  49734 [ACK] Seq=1 Ack=51 Win=909 Len=0"
"197","0.659048","127.0.0.1","127.0.0.1","TCP","45","49739  >  49738 [PSH, ACK] Seq=50 Ack=1 Win=255 Len=1"
"198","0.659106","127.0.0.1","127.0.0.1","TCP","44","49738  >  49739 [ACK] Seq=1 Ack=51 Win=911 Len=0"
"199","0.659269","127.0.0.1","127.0.0.1","TCP","45","49734  >  49735 [PSH, ACK] Seq=51 Ack=1 Win=255 Len=1"
"200","0.659292","127.0.0.1","127.0.0.1","TCP","44","49735  >  49734 [ACK] Seq=1 Ack=52 Win=909 Len=0"
"201","0.659687","127.0.0.1","127.0.0.1","TCP","45","49739  >  49738 [PSH, ACK] Seq=51 Ack=1 Win=255 Len=1"
"202","0.659743","127.0.0.1","127.0.0.1","TCP","44","49738  >  49739 [ACK] Seq=1 Ack=52 Win=911 Len=0"
"203","0.659922","127.0.0.1","127.0.0.1","TCP","45","49734  >  49735 [PSH, ACK] Seq=52 Ack=1 Win=255 Len=1"
"204","0.659967","127.0.0.1","127.0.0.1","TCP","44","49735  >  49734 [ACK] Seq=1 Ack=53 Win=909 Len=0"
"205","0.660230","127.0.0.1","127.0.0.1","TCP","45","49739  >  49738 [PSH, ACK] Seq=52 Ack=1 Win=255 Len=1"
"206","0.660280","127.0.0.1","127.0.0.1","TCP","44","49738  >  49739 [ACK] Seq=1 Ack=53 Win=911 Len=0"
"207","0.660453","127.0.0.1","127.0.0.1","TCP","45","49734  >  49735 [PSH, ACK] Seq=53 Ack=1 Win=255 Len=1"
"208","0.660476","127.0.0.1","127.0.0.1","TCP","44","49735  >  49734 [ACK] Seq=1 Ack=54 Win=909 Len=0"
"209","0.660795","127.0.0.1","127.0.0.1","TCP","45","49739  >  49738 [PSH, ACK] Seq=53 Ack=1 Win=255 Len=1"
"210","0.660848","127.0.0.1","127.0.0.1","TCP","44","49738  >  49739 [ACK] Seq=1 Ack=54 Win=911 Len=0"
"211","0.661085","127.0.0.1","127.0.0.1","TCP","45","49734  >  49735 [PSH, ACK] Seq=54 Ack=1 Win=255 Len=1"
"212","0.661135","127.0.0.1","127.0.0.1","TCP","44","49735  >  49734 [ACK] Seq=1 Ack=55 Win=909 Len=0"
"213","0.661409","127.0.0.1","127.0.0.1","TCP","45","49739  >  49738 [PSH, ACK] Seq=54 Ack=1 Win=255 Len=1"
"214","0.661464","127.0.0.1","127.0.0.1","TCP","44","49738  >  49739 [ACK] Seq=1 Ack=55 Win=911 Len=0"
"215","0.661704","127.0.0.1","127.0.0.1","TCP","45","49734  >  49735 [PSH, ACK] Seq=55 Ack=1 Win=255 Len=1"
"216","0.661745","127.0.0.1","127.0.0.1","TCP","44","49735  >  49734 [ACK] Seq=1 Ack=56 Win=909 Len=0"
"217","0.662026","127.0.0.1","127.0.0.1","TCP","45","49739  >  49738 [PSH, ACK] Seq=55 Ack=1 Win=255 Len=1"
"218","0.662079","127.0.0.1","127.0.0.1","TCP","44","49738  >  49739 [ACK] Seq=1 Ack=56 Win=911 Len=0"
"219","0.662242","127.0.0.1","127.0.0.1","TCP","45","49734  >  49735 [PSH, ACK] Seq=56 Ack=1 Win=255 Len=1"
"220","0.662274","127.0.0.1","127.0.0.1","TCP","44","49735  >  49734 [ACK] Seq=1 Ack=57 Win=909 Len=0"
"221","0.662685","127.0.0.1","127.0.0.1","TCP","45","49739  >  49738 [PSH, ACK] Seq=56 Ack=1 Win=255 Len=1"
"222","0.662740","127.0.0.1","127.0.0.1","TCP","44","49738  >  49739 [ACK] Seq=1 Ack=57 Win=911 Len=0"
"223","0.662906","127.0.0.1","127.0.0.1","TCP","45","49734  >  49735 [PSH, ACK] Seq=57 Ack=1 Win=255 Len=1"
"224","0.662950","127.0.0.1","127.0.0.1","TCP","44","49735  >  49734 [ACK] Seq=1 Ack=58 Win=909 Len=0"
"225","0.663288","127.0.0.1","127.0.0.1","TCP","45","49739  >  49738 [PSH, ACK] Seq=57 Ack=1 Win=255 Len=1"
"226","0.663382","127.0.0.1","127.0.0.1","TCP","44","49738  >  49739 [ACK] Seq=1 Ack=58 Win=911 Len=0"
"227","0.663568","127.0.0.1","127.0.0.1","TCP","45","49734  >  49735 [PSH, ACK] Seq=58 Ack=1 Win=255 Len=1"
"228","0.663614","127.0.0.1","127.0.0.1","TCP","44","49735  >  49734 [ACK] Seq=1 Ack=59 Win=909 Len=0"
"229","0.663904","127.0.0.1","127.0.0.1","TCP","45","49739  >  49738 [PSH, ACK] Seq=58 Ack=1 Win=255 Len=1"
"230","0.663959","127.0.0.1","127.0.0.1","TCP","44","49738  >  49739 [ACK] Seq=1 Ack=59 Win=911 Len=0"
"231","0.664147","127.0.0.1","127.0.0.1","TCP","45","49734  >  49735 [PSH, ACK] Seq=59 Ack=1 Win=255 Len=1"
"232","0.664192","127.0.0.1","127.0.0.1","TCP","44","49735  >  49734 [ACK] Seq=1 Ack=60 Win=909 Len=0"
"233","0.664439","127.0.0.1","127.0.0.1","TCP","45","49739  >  49738 [PSH, ACK] Seq=59 Ack=1 Win=255 Len=1"
"234","0.664486","127.0.0.1","127.0.0.1","TCP","44","49738  >  49739 [ACK] Seq=1 Ack=60 Win=911 Len=0"
"235","0.664813","127.0.0.1","127.0.0.1","TCP","45","49734  >  49735 [PSH, ACK] Seq=60 Ack=1 Win=255 Len=1"
"236","0.664860","127.0.0.1","127.0.0.1","TCP","44","49735  >  49734 [ACK] Seq=1 Ack=61 Win=909 Len=0"
"237","0.665182","127.0.0.1","127.0.0.1","TCP","45","49739  >  49738 [PSH, ACK] Seq=60 Ack=1 Win=255 Len=1"
"238","0.665241","127.0.0.1","127.0.0.1","TCP","44","49738  >  49739 [ACK] Seq=1 Ack=61 Win=911 Len=0"
"239","0.666033","127.0.0.1","127.0.0.1","TCP","45","49734  >  49735 [PSH, ACK] Seq=61 Ack=1 Win=255 Len=1"
"240","0.666094","127.0.0.1","127.0.0.1","TCP","44","49735  >  49734 [ACK] Seq=1 Ack=62 Win=909 Len=0"
"241","0.666549","127.0.0.1","127.0.0.1","TCP","45","49739  >  49738 [PSH, ACK] Seq=61 Ack=1 Win=255 Len=1"
"242","0.666607","127.0.0.1","127.0.0.1","TCP","44","49738  >  49739 [ACK] Seq=1 Ack=62 Win=911 Len=0"
"243","0.667116","127.0.0.1","127.0.0.1","TCP","45","49734  >  49735 [PSH, ACK] Seq=62 Ack=1 Win=255 Len=1"
"244","0.667205","127.0.0.1","127.0.0.1","TCP","44","49735  >  49734 [ACK] Seq=1 Ack=63 Win=909 Len=0"
"245","1.055285","127.0.0.1","127.0.0.1","TCP","45","49734  >  49735 [PSH, ACK] Seq=63 Ack=1 Win=255 Len=1"
"246","1.055375","127.0.0.1","127.0.0.1","TCP","44","49735  >  49734 [ACK] Seq=1 Ack=64 Win=909 Len=0"
"247","1.056026","127.0.0.1","127.0.0.1","TCP","45","49739  >  49738 [PSH, ACK] Seq=62 Ack=1 Win=255 Len=1"
"248","1.056147","127.0.0.1","127.0.0.1","TCP","44","49738  >  49739 [ACK] Seq=1 Ack=63 Win=911 Len=0"
"249","1.056229","127.0.0.1","127.0.0.1","TCP","45","49739  >  49738 [PSH, ACK] Seq=63 Ack=1 Win=255 Len=1"
"250","1.056301","127.0.0.1","127.0.0.1","TCP","44","49738  >  49739 [ACK] Seq=1 Ack=64 Win=911 Len=0"
"251","1.056975","127.0.0.1","127.0.0.1","TCP","45","49734  >  49735 [PSH, ACK] Seq=64 Ack=1 Win=255 Len=1"
"252","1.057069","127.0.0.1","127.0.0.1","TCP","44","49735  >  49734 [ACK] Seq=1 Ack=65 Win=909 Len=0"
"253","1.057760","127.0.0.1","127.0.0.1","TCP","45","49739  >  49738 [PSH, ACK] Seq=64 Ack=1 Win=255 Len=1"
"254","1.057893","127.0.0.1","127.0.0.1","TCP","44","49738  >  49739 [ACK] Seq=1 Ack=65 Win=911 Len=0"
"255","1.058262","127.0.0.1","127.0.0.1","TCP","45","49734  >  49735 [PSH, ACK] Seq=65 Ack=1 Win=255 Len=1"
"256","1.058352","127.0.0.1","127.0.0.1","TCP","44","49735  >  49734 [ACK] Seq=1 Ack=66 Win=909 Len=0"
"257","1.059171","127.0.0.1","127.0.0.1","TCP","45","49739  >  49738 [PSH, ACK] Seq=65 Ack=1 Win=255 Len=1"
"258","1.059292","127.0.0.1","127.0.0.1","TCP","44","49738  >  49739 [ACK] Seq=1 Ack=66 Win=911 Len=0"
"259","1.060349","127.0.0.1","127.0.0.1","TCP","45","49734  >  49735 [PSH, ACK] Seq=66 Ack=1 Win=255 Len=1"
"260","1.060442","127.0.0.1","127.0.0.1","TCP","44","49735  >  49734 [ACK] Seq=1 Ack=67 Win=909 Len=0"
"261","1.060890","127.0.0.1","127.0.0.1","TCP","45","49739  >  49738 [PSH, ACK] Seq=66 Ack=1 Win=255 Len=1"
"262","1.061001","127.0.0.1","127.0.0.1","TCP","44","49738  >  49739 [ACK] Seq=1 Ack=67 Win=911 Len=0"
"263","1.061535","127.0.0.1","127.0.0.1","TCP","45","49734  >  49735 [PSH, ACK] Seq=67 Ack=1 Win=255 Len=1"
"264","1.061594","127.0.0.1","127.0.0.1","TCP","44","49735  >  49734 [ACK] Seq=1 Ack=68 Win=909 Len=0"
"265","1.062254","127.0.0.1","127.0.0.1","TCP","45","49739  >  49738 [PSH, ACK] Seq=67 Ack=1 Win=255 Len=1"
"266","1.062363","127.0.0.1","127.0.0.1","TCP","44","49738  >  49739 [ACK] Seq=1 Ack=68 Win=911 Len=0"
"267","1.062633","127.0.0.1","127.0.0.1","TCP","45","49734  >  49735 [PSH, ACK] Seq=68 Ack=1 Win=255 Len=1"
"268","1.062685","127.0.0.1","127.0.0.1","TCP","44","49735  >  49734 [ACK] Seq=1 Ack=69 Win=909 Len=0"
"269","1.063430","127.0.0.1","127.0.0.1","TCP","45","49739  >  49738 [PSH, ACK] Seq=68 Ack=1 Win=255 Len=1"
"270","1.063535","127.0.0.1","127.0.0.1","TCP","44","49738  >  49739 [ACK] Seq=1 Ack=69 Win=911 Len=0"
"271","1.063750","127.0.0.1","127.0.0.1","TCP","45","49734  >  49735 [PSH, ACK] Seq=69 Ack=1 Win=255 Len=1"
"272","1.063790","127.0.0.1","127.0.0.1","TCP","44","49735  >  49734 [ACK] Seq=1 Ack=70 Win=909 Len=0"
"273","1.064417","127.0.0.1","127.0.0.1","TCP","45","49739  >  49738 [PSH, ACK] Seq=69 Ack=1 Win=255 Len=1"
"274","1.064529","127.0.0.1","127.0.0.1","TCP","44","49738  >  49739 [ACK] Seq=1 Ack=70 Win=911 Len=0"
"275","1.064850","127.0.0.1","127.0.0.1","TCP","45","49734  >  49735 [PSH, ACK] Seq=70 Ack=1 Win=255 Len=1"
"276","1.064887","127.0.0.1","127.0.0.1","TCP","44","49735  >  49734 [ACK] Seq=1 Ack=71 Win=909 Len=0"
"277","1.065978","127.0.0.1","127.0.0.1","TCP","45","49739  >  49738 [PSH, ACK] Seq=70 Ack=1 Win=255 Len=1"
"278","1.066092","127.0.0.1","127.0.0.1","TCP","44","49738  >  49739 [ACK] Seq=1 Ack=71 Win=911 Len=0"
"279","1.066441","127.0.0.1","127.0.0.1","TCP","45","49734  >  49735 [PSH, ACK] Seq=71 Ack=1 Win=255 Len=1"
"280","1.066512","127.0.0.1","127.0.0.1","TCP","44","49735  >  49734 [ACK] Seq=1 Ack=72 Win=909 Len=0"
"281","1.067334","127.0.0.1","127.0.0.1","TCP","45","49739  >  49738 [PSH, ACK] Seq=71 Ack=1 Win=255 Len=1"
"282","1.067539","127.0.0.1","127.0.0.1","TCP","44","49738  >  49739 [ACK] Seq=1 Ack=72 Win=911 Len=0"
"283","1.068045","127.0.0.1","127.0.0.1","TCP","45","49734  >  49735 [PSH, ACK] Seq=72 Ack=1 Win=255 Len=1"
"284","1.068121","127.0.0.1","127.0.0.1","TCP","44","49735  >  49734 [ACK] Seq=1 Ack=73 Win=909 Len=0"
"285","1.068881","127.0.0.1","127.0.0.1","TCP","45","49739  >  49738 [PSH, ACK] Seq=72 Ack=1 Win=255 Len=1"
"286","1.068976","127.0.0.1","127.0.0.1","TCP","44","49738  >  49739 [ACK] Seq=1 Ack=73 Win=911 Len=0"
"287","1.069400","127.0.0.1","127.0.0.1","TCP","45","49734  >  49735 [PSH, ACK] Seq=73 Ack=1 Win=255 Len=1"
"288","1.069492","127.0.0.1","127.0.0.1","TCP","44","49735  >  49734 [ACK] Seq=1 Ack=74 Win=909 Len=0"
"289","1.070112","127.0.0.1","127.0.0.1","TCP","45","49739  >  49738 [PSH, ACK] Seq=73 Ack=1 Win=255 Len=1"
"290","1.070196","127.0.0.1","127.0.0.1","TCP","44","49738  >  49739 [ACK] Seq=1 Ack=74 Win=911 Len=0"
"291","1.070448","127.0.0.1","127.0.0.1","TCP","45","49734  >  49735 [PSH, ACK] Seq=74 Ack=1 Win=255 Len=1"
"292","1.070474","127.0.0.1","127.0.0.1","TCP","44","49735  >  49734 [ACK] Seq=1 Ack=75 Win=909 Len=0"
"293","1.070919","127.0.0.1","127.0.0.1","TCP","45","49739  >  49738 [PSH, ACK] Seq=74 Ack=1 Win=255 Len=1"
"294","1.071022","127.0.0.1","127.0.0.1","TCP","44","49738  >  49739 [ACK] Seq=1 Ack=75 Win=911 Len=0"
"295","1.071154","127.0.0.1","127.0.0.1","TCP","45","49734  >  49735 [PSH, ACK] Seq=75 Ack=1 Win=255 Len=1"
"296","1.071177","127.0.0.1","127.0.0.1","TCP","44","49735  >  49734 [ACK] Seq=1 Ack=76 Win=909 Len=0"
"297","1.071659","127.0.0.1","127.0.0.1","TCP","45","49739  >  49738 [PSH, ACK] Seq=75 Ack=1 Win=255 Len=1"
"298","1.071761","127.0.0.1","127.0.0.1","TCP","44","49738  >  49739 [ACK] Seq=1 Ack=76 Win=911 Len=0"
"299","1.071843","127.0.0.1","127.0.0.1","TCP","45","49734  >  49735 [PSH, ACK] Seq=76 Ack=1 Win=255 Len=1"
"300","1.071859","127.0.0.1","127.0.0.1","TCP","44","49735  >  49734 [ACK] Seq=1 Ack=77 Win=909 Len=0"
"301","1.072316","127.0.0.1","127.0.0.1","TCP","45","49739  >  49738 [PSH, ACK] Seq=76 Ack=1 Win=255 Len=1"
"302","1.072433","127.0.0.1","127.0.0.1","TCP","44","49738  >  49739 [ACK] Seq=1 Ack=77 Win=911 Len=0"
"303","1.072836","127.0.0.1","127.0.0.1","TCP","45","49734  >  49735 [PSH, ACK] Seq=77 Ack=1 Win=255 Len=1"
"304","1.072851","127.0.0.1","127.0.0.1","TCP","44","49735  >  49734 [ACK] Seq=1 Ack=78 Win=909 Len=0"
"305","1.073246","127.0.0.1","127.0.0.1","TCP","45","49739  >  49738 [PSH, ACK] Seq=77 Ack=1 Win=255 Len=1"
"306","1.073350","127.0.0.1","127.0.0.1","TCP","44","49738  >  49739 [ACK] Seq=1 Ack=78 Win=911 Len=0"
"307","1.073430","127.0.0.1","127.0.0.1","TCP","45","49734  >  49735 [PSH, ACK] Seq=78 Ack=1 Win=255 Len=1"
"308","1.073445","127.0.0.1","127.0.0.1","TCP","44","49735  >  49734 [ACK] Seq=1 Ack=79 Win=909 Len=0"
"309","1.073832","127.0.0.1","127.0.0.1","TCP","45","49739  >  49738 [PSH, ACK] Seq=78 Ack=1 Win=255 Len=1"
"310","1.073948","127.0.0.1","127.0.0.1","TCP","44","49738  >  49739 [ACK] Seq=1 Ack=79 Win=911 Len=0"
"311","1.074016","127.0.0.1","127.0.0.1","TCP","45","49734  >  49735 [PSH, ACK] Seq=79 Ack=1 Win=255 Len=1"
"312","1.074031","127.0.0.1","127.0.0.1","TCP","44","49735  >  49734 [ACK] Seq=1 Ack=80 Win=909 Len=0"
"313","1.074633","127.0.0.1","127.0.0.1","TCP","45","49739  >  49738 [PSH, ACK] Seq=79 Ack=1 Win=255 Len=1"
"314","1.074733","127.0.0.1","127.0.0.1","TCP","44","49738  >  49739 [ACK] Seq=1 Ack=80 Win=911 Len=0"
"315","1.074898","127.0.0.1","127.0.0.1","TCP","45","49734  >  49735 [PSH, ACK] Seq=80 Ack=1 Win=255 Len=1"
"316","1.074938","127.0.0.1","127.0.0.1","TCP","44","49735  >  49734 [ACK] Seq=1 Ack=81 Win=909 Len=0"
"317","1.075153","127.0.0.1","127.0.0.1","TCP","45","49739  >  49738 [PSH, ACK] Seq=80 Ack=1 Win=255 Len=1"
"318","1.075247","127.0.0.1","127.0.0.1","TCP","44","49738  >  49739 [ACK] Seq=1 Ack=81 Win=911 Len=0"
"319","1.075356","127.0.0.1","127.0.0.1","TCP","45","49734  >  49735 [PSH, ACK] Seq=81 Ack=1 Win=255 Len=1"
"320","1.075384","127.0.0.1","127.0.0.1","TCP","44","49735  >  49734 [ACK] Seq=1 Ack=82 Win=909 Len=0"
"321","1.075760","127.0.0.1","127.0.0.1","TCP","45","49739  >  49738 [PSH, ACK] Seq=81 Ack=1 Win=255 Len=1"
"322","1.075844","127.0.0.1","127.0.0.1","TCP","44","49738  >  49739 [ACK] Seq=1 Ack=82 Win=911 Len=0"
"323","1.078403","127.0.0.1","127.0.0.1","TCP","45","49734  >  49735 [PSH, ACK] Seq=82 Ack=1 Win=255 Len=1"
"324","1.078442","127.0.0.1","127.0.0.1","TCP","44","49735  >  49734 [ACK] Seq=1 Ack=83 Win=909 Len=0"
"325","1.078663","127.0.0.1","127.0.0.1","TCP","45","49739  >  49738 [PSH, ACK] Seq=82 Ack=1 Win=255 Len=1"
"326","1.078815","127.0.0.1","127.0.0.1","TCP","44","49738  >  49739 [ACK] Seq=1 Ack=83 Win=911 Len=0"
"327","1.179412","127.0.0.1","127.0.0.1","TCP","45","49734  >  49735 [PSH, ACK] Seq=83 Ack=1 Win=255 Len=1"
"328","1.179456","127.0.0.1","127.0.0.1","TCP","44","49735  >  49734 [ACK] Seq=1 Ack=84 Win=909 Len=0"
"329","4.029904","127.0.0.1","127.0.0.1","TCP","45","49739  >  49738 [PSH, ACK] Seq=83 Ack=1 Win=255 Len=1"
"330","4.030081","127.0.0.1","127.0.0.1","TCP","44","49738  >  49739 [ACK] Seq=1 Ack=84 Win=911 Len=0"
"331","4.031321","127.0.0.1","127.0.0.1","TCP","45","49734  >  49735 [PSH, ACK] Seq=84 Ack=1 Win=255 Len=1"
"332","4.031393","127.0.0.1","127.0.0.1","TCP","44","49735  >  49734 [ACK] Seq=1 Ack=85 Win=909 Len=0"
"333","4.153318","0.0.0.0","255.255.255.255","DHCP","332","DHCP Discover - Transaction ID 0xa3d53c8a"
"334","4.154498","0.0.0.0","255.255.255.255","DHCP","332","DHCP Discover - Transaction ID 0xa3d53c8a"
"335","8.749332","127.0.0.1","127.0.0.1","TCP","45","49734  >  49735 [PSH, ACK] Seq=85 Ack=1 Win=255 Len=1"
"336","8.749412","127.0.0.1","127.0.0.1","TCP","44","49735  >  49734 [ACK] Seq=1 Ack=86 Win=909 Len=0"
"337","8.749974","127.0.0.1","127.0.0.1","TCP","45","49739  >  49738 [PSH, ACK] Seq=84 Ack=1 Win=255 Len=1"
"338","8.750103","127.0.0.1","127.0.0.1","TCP","44","49738  >  49739 [ACK] Seq=1 Ack=85 Win=911 Len=0"
"339","8.750195","127.0.0.1","127.0.0.1","TCP","45","49739  >  49738 [PSH, ACK] Seq=85 Ack=1 Win=255 Len=1"
"340","8.750272","127.0.0.1","127.0.0.1","TCP","44","49738  >  49739 [ACK] Seq=1 Ack=86 Win=911 Len=0"
"341","8.750758","127.0.0.1","127.0.0.1","TCP","45","49734  >  49735 [PSH, ACK] Seq=86 Ack=1 Win=255 Len=1"
"342","8.750866","127.0.0.1","127.0.0.1","TCP","44","49735  >  49734 [ACK] Seq=1 Ack=87 Win=909 Len=0"
"343","8.751994","127.0.0.1","127.0.0.1","TCP","45","49739  >  49738 [PSH, ACK] Seq=86 Ack=1 Win=255 Len=1"
"344","8.752131","127.0.0.1","127.0.0.1","TCP","44","49738  >  49739 [ACK] Seq=1 Ack=87 Win=911 Len=0"
"345","8.752758","127.0.0.1","127.0.0.1","TCP","45","49734  >  49735 [PSH, ACK] Seq=87 Ack=1 Win=255 Len=1"
"346","8.752861","127.0.0.1","127.0.0.1","TCP","44","49735  >  49734 [ACK] Seq=1 Ack=88 Win=909 Len=0"
"347","8.753889","127.0.0.1","127.0.0.1","TCP","45","49739  >  49738 [PSH, ACK] Seq=87 Ack=1 Win=255 Len=1"
"348","8.754051","127.0.0.1","127.0.0.1","TCP","44","49738  >  49739 [ACK] Seq=1 Ack=88 Win=911 Len=0"
"349","8.755081","127.0.0.1","127.0.0.1","TCP","45","49734  >  49735 [PSH, ACK] Seq=88 Ack=1 Win=255 Len=1"
"350","8.755214","127.0.0.1","127.0.0.1","TCP","44","49735  >  49734 [ACK] Seq=1 Ack=89 Win=909 Len=0"
"351","8.755761","127.0.0.1","127.0.0.1","TCP","45","49739  >  49738 [PSH, ACK] Seq=88 Ack=1 Win=255 Len=1"
"352","8.755945","127.0.0.1","127.0.0.1","TCP","44","49738  >  49739 [ACK] Seq=1 Ack=89 Win=911 Len=0"
"353","8.756530","127.0.0.1","127.0.0.1","TCP","45","49734  >  49735 [PSH, ACK] Seq=89 Ack=1 Win=255 Len=1"
"354","8.756640","127.0.0.1","127.0.0.1","TCP","44","49735  >  49734 [ACK] Seq=1 Ack=90 Win=909 Len=0"
"355","8.757687","127.0.0.1","127.0.0.1","TCP","45","49739  >  49738 [PSH, ACK] Seq=89 Ack=1 Win=255 Len=1"
"356","8.757826","127.0.0.1","127.0.0.1","TCP","44","49738  >  49739 [ACK] Seq=1 Ack=90 Win=911 Len=0"
"357","8.758274","127.0.0.1","127.0.0.1","TCP","45","49734  >  49735 [PSH, ACK] Seq=90 Ack=1 Win=255 Len=1"
"358","8.758396","127.0.0.1","127.0.0.1","TCP","44","49735  >  49734 [ACK] Seq=1 Ack=91 Win=909 Len=0"
"359","8.759439","127.0.0.1","127.0.0.1","TCP","45","49739  >  49738 [PSH, ACK] Seq=90 Ack=1 Win=255 Len=1"
"360","8.759603","127.0.0.1","127.0.0.1","TCP","44","49738  >  49739 [ACK] Seq=1 Ack=91 Win=911 Len=0"
"361","8.760175","127.0.0.1","127.0.0.1","TCP","45","49734  >  49735 [PSH, ACK] Seq=91 Ack=1 Win=255 Len=1"
"362","8.760234","127.0.0.1","127.0.0.1","TCP","44","49735  >  49734 [ACK] Seq=1 Ack=92 Win=909 Len=0"
"363","8.761561","127.0.0.1","127.0.0.1","TCP","45","49739  >  49738 [PSH, ACK] Seq=91 Ack=1 Win=255 Len=1"
"364","8.761687","127.0.0.1","127.0.0.1","TCP","44","49738  >  49739 [ACK] Seq=1 Ack=92 Win=911 Len=0"
"365","8.762347","127.0.0.1","127.0.0.1","TCP","45","49734  >  49735 [PSH, ACK] Seq=92 Ack=1 Win=255 Len=1"
"366","8.762464","127.0.0.1","127.0.0.1","TCP","44","49735  >  49734 [ACK] Seq=1 Ack=93 Win=909 Len=0"
"367","8.763448","127.0.0.1","127.0.0.1","TCP","45","49739  >  49738 [PSH, ACK] Seq=92 Ack=1 Win=255 Len=1"
"368","8.763562","127.0.0.1","127.0.0.1","TCP","44","49738  >  49739 [ACK] Seq=1 Ack=93 Win=911 Len=0"
"369","8.764266","127.0.0.1","127.0.0.1","TCP","45","49734  >  49735 [PSH, ACK] Seq=93 Ack=1 Win=255 Len=1"
"370","8.764354","127.0.0.1","127.0.0.1","TCP","44","49735  >  49734 [ACK] Seq=1 Ack=94 Win=909 Len=0"
"371","8.764985","127.0.0.1","127.0.0.1","TCP","45","49739  >  49738 [PSH, ACK] Seq=93 Ack=1 Win=255 Len=1"
"372","8.765102","127.0.0.1","127.0.0.1","TCP","44","49738  >  49739 [ACK] Seq=1 Ack=94 Win=911 Len=0"
"373","8.765977","127.0.0.1","127.0.0.1","TCP","45","49734  >  49735 [PSH, ACK] Seq=94 Ack=1 Win=255 Len=1"
"374","8.766071","127.0.0.1","127.0.0.1","TCP","44","49735  >  49734 [ACK] Seq=1 Ack=95 Win=909 Len=0"
"375","8.766639","127.0.0.1","127.0.0.1","TCP","45","49739  >  49738 [PSH, ACK] Seq=94 Ack=1 Win=255 Len=1"
"376","8.766769","127.0.0.1","127.0.0.1","TCP","44","49738  >  49739 [ACK] Seq=1 Ack=95 Win=911 Len=0"
"377","8.767288","127.0.0.1","127.0.0.1","TCP","45","49734  >  49735 [PSH, ACK] Seq=95 Ack=1 Win=255 Len=1"
"378","8.767473","127.0.0.1","127.0.0.1","TCP","44","49735  >  49734 [ACK] Seq=1 Ack=96 Win=909 Len=0"
"379","8.768604","127.0.0.1","127.0.0.1","TCP","45","49739  >  49738 [PSH, ACK] Seq=95 Ack=1 Win=255 Len=1"
